{
  "$schema": "http://json-schema.org/draft-07/schema#",
  "$id": "https://github.com/creativemyntra/keel/agent-output-schema.json",
  "title": "Keel Agent Phase Output",
  "description": "Contract for the output file each Keel phase agent writes to .keel/state/<story-id>/<NN>-<agent>.json. This is how agents pass context to each other.",
  "type": "object",
  "required": ["phase", "agent", "story_id", "confidence", "findings", "acceptance_criteria_ids", "decisions", "next_phase"],
  "dependentRequired": {
    "phase": ["assumptions", "interpretations_considered"],
    "agent": ["assumptions", "interpretations_considered"]
  },
  "if": {
    "properties": {
      "phase": { "const": 3 },
      "agent": { "const": "ui-designer" }
    }
  },
  "then": {
    "required": ["component_contract"]
  },
  "if": {
    "properties": {
      "phase": { "const": 5 },
      "agent": { "const": "software-engineer" }
    }
  },
  "then": {
    "required": ["assumptions", "interpretations_considered", "implementation_plan_path"]
  },
  "properties": {
    "phase": {
      "type": "integer",
      "minimum": 1,
      "maximum": 10,
      "description": "Pipeline phase number (1=product-owner … 10=release-manager)"
    },
    "agent": {
      "type": "string",
      "description": "tdd-red and tdd-green are DEPRECATED (legacy <=v3.12); accepted for validating old state files only, not for new stories.",
      "enum": [
        "product-owner",
        "business-analyst",
        "ui-designer",
        "solution-architect",
        "software-engineer",
        "qa-engineer",
        "e2e-engineer",
        "security-engineer",
        "technical-writer",
        "release-manager",
        "tdd-red",
        "tdd-green"
      ]
    },
    "story_id": {
      "type": "string",
      "description": "Story identifier, e.g. FEAT-1 or HART-287"
    },
    "confidence": {
      "type": "string",
      "enum": ["high", "medium", "low"]
    },
    "findings": {
      "type": "array",
      "minItems": 1,
      "maxItems": 15,
      "items": {
        "type": "object",
        "required": ["id", "text", "severity", "state"],
        "properties": {
          "id": {
            "type": "string",
            "pattern": "^[A-Z]+-[0-9]+$",
            "description": "Finding identifier (e.g., BUG-1, PERF-2, SEC-3)"
          },
          "text": {
            "type": "string",
            "description": "Human-readable finding description. Reference file paths and identifiers — never inline file contents."
          },
          "severity": {
            "type": "string",
            "enum": ["CRITICAL", "HIGH", "MEDIUM", "LOW"],
            "description": "CRITICAL/HIGH findings block PASS if OPEN. MEDIUM/LOW do not block."
          },
          "state": {
            "type": "string",
            "enum": ["OPEN", "RESOLVED", "DEFERRED", "WAIVED"],
            "description": "Terminal state. OPEN blocks PASS if severity CRITICAL/HIGH. RESOLVED requires commit verification. DEFERRED/WAIVED require human approval."
          },
          "evidence": {
            "type": "object",
            "description": "Evidence for the state transition (optional, populated by keel state finding --set-state)",
            "properties": {
              "commit": {
                "type": "string",
                "description": "Git commit SHA that resolved this finding"
              },
              "deferred_to": {
                "type": "string",
                "description": "Phase or future ticket this was deferred to"
              },
              "approver": {
                "type": "string",
                "description": "Name/email of human approver (for WAIVED)"
              },
              "reason": {
                "type": "string",
                "description": "Verbatim reason for deferral or waiver (>= 15 words)"
              }
            },
            "additionalProperties": false
          }
        },
        "additionalProperties": false
      },
      "description": "Findings from this phase: defects, performance issues, security concerns, etc. Each finding has severity and state. CRITICAL/HIGH findings at OPEN block pipeline advancement."
    },
    "acceptance_criteria_ids": {
      "type": "array",
      "items": { "type": "string", "pattern": "^AC-[0-9]+$" },
      "description": "Acceptance criteria this phase addresses. Phase 1 (product-owner) defines the full set; every later phase must account for all of them. Dropping an AC without a documented descope decision is drift and fails the handshake gate."
    },
    "decisions": {
      "type": "array",
      "items": { "type": "string" },
      "description": "Decisions made this phase with one-line rationale (audited)"
    },
    "artifacts": {
      "type": "array",
      "items": { "type": "string" },
      "description": "Repo-relative paths to files this phase produced or changed"
    },
    "next_phase": {
      "type": ["integer", "null"],
      "description": "Phase that should run next; null when the pipeline is complete"
    },
    "blockers": {
      "type": "array",
      "items": { "type": "string" },
      "description": "Anything preventing the next phase from starting"
    },
    "design_review_checklist": {
      "type": "object",
      "description": "Phase 3 (UI designer) required review checklist. Must pass all items for gate C-0008 to PASS.",
      "required": ["story_alignment", "wcag_2_1_aa", "responsive_design", "design_tokens", "palette_typography"],
      "properties": {
        "story_alignment": {
          "type": "boolean",
          "description": "Design aligns with story requirements and user flows"
        },
        "wcag_2_1_aa": {
          "type": "boolean",
          "description": "Design meets WCAG 2.1 Level AA accessibility compliance"
        },
        "responsive_design": {
          "type": "boolean",
          "description": "Layout works on mobile (375px), tablet (768px), desktop (1200px+)"
        },
        "design_tokens": {
          "type": "boolean",
          "description": "All colors, spacing, typography use design system tokens (not hardcoded values)"
        },
        "palette_typography": {
          "type": "boolean",
          "description": "Color palette and typography specs documented (min 2 font families, max 5 colors primary)"
        }
      },
      "additionalProperties": false
    },
    "timestamp": {
      "type": "string",
      "format": "date-time"
    },
    "tokens_used": {
      "type": "object",
      "description": "Optional token usage self-reported by the agent (for cost-tracking dashboard T1-1)",
      "properties": {
        "input_tokens": { "type": "integer", "minimum": 0 },
        "output_tokens": { "type": "integer", "minimum": 0 },
        "model": { "type": "string" }
      },
      "additionalProperties": false
    },
    "assumptions": {
      "type": "array",
      "minItems": 0,
      "items": {
        "type": "object",
        "required": ["area", "assumption", "risk"],
        "properties": {
          "area": {
            "type": "string",
            "enum": ["scope", "data", "behavior", "performance", "security"],
            "description": "Category of assumption: scope, data shape, user behavior, performance target, or security boundary"
          },
          "assumption": {
            "type": "string",
            "minLength": 8,
            "description": "The assumption itself (e.g., 'payment processing is fast <2s', 'user IDs are UUIDs')"
          },
          "risk": {
            "type": "string",
            "minLength": 8,
            "description": "Risk if the assumption is false (e.g., 'feature fails on slow networks', 'migration needs rewrite')"
          }
        },
        "additionalProperties": false
      },
      "description": "K-1: Assumptions surfaced before planning (phase 5 software-engineer only). Required: minItems 1 for phase 5."
    },
    "interpretations_considered": {
      "type": "array",
      "items": {
        "type": "object",
        "required": ["ac_id", "options"],
        "properties": {
          "ac_id": {
            "type": "string",
            "pattern": "^AC-[0-9]+$",
            "description": "Acceptance criterion ID that was ambiguous"
          },
          "options": {
            "type": "array",
            "minItems": 2,
            "items": { "type": "string" },
            "description": "At least 2 plausible readings of this AC. Phase-1 blockers labeled ambiguous must appear here."
          }
        },
        "additionalProperties": false
      },
      "description": "K-2: Interpretations considered for ambiguous ACs (phase 5 software-engineer only). Required: one entry per ambiguous AC."
    },
    "component_contract": {
      "type": "array",
      "minItems": 1,
      "items": {
        "type": "object",
        "required": ["component", "data_testid", "states", "aria"],
        "properties": {
          "component": {
            "type": "string",
            "description": "Component name (e.g., 'KPI Card', 'Button', 'Modal')"
          },
          "data_testid": {
            "type": "string",
            "pattern": "^[a-z0-9]+(-[a-z0-9]+)*$",
            "description": "Kebab-case data-testid selector. Must be unique per component. Developer and E2E engineer use this exact value."
          },
          "states": {
            "type": "array",
            "minItems": 1,
            "items": { "type": "string" },
            "description": "Visual/interaction states: default, hover, focus, active, disabled, error, loading, selected, etc."
          },
          "aria": {
            "type": "object",
            "description": "Accessibility attributes (role, aria-label, aria-live, etc.)",
            "properties": {
              "role": { "type": "string" },
              "aria_label": { "type": "string" },
              "aria_labelledby": { "type": "string" },
              "aria_live": { "type": "string" },
              "aria_expanded": { "type": "string" },
              "type": { "type": "string" }
            },
            "additionalProperties": true
          }
        },
        "additionalProperties": false
      },
      "description": "Component contract: testid binding spec for developer and E2E engineer. Phase 3 (ui-designer) emits this; software-engineer implements exact testids; e2e-engineer uses exact selectors. Uniqueness enforced at gate."
    },
    "implementation_plan_path": {
      "type": "string",
      "pattern": "^docs/plans/.*implementation-plan\\.md$",
      "description": "K-3: Path to implementation plan file (phase 5 software-engineer only). Must exist and contain required sections."
    }
  },
  "additionalProperties": false
}
