{
  "phase": 4,
  "agent": "solution-architect",
  "story_id": "BASELINE-002",
  "confidence": "high",
  "findings": [
    {
      "id": "OPEN-3-RESOLVED",
      "text": "OPEN-3 (S3 region/bucket/CDN, was BLOCKING phase 5): resolved to us-east-1 same-region bucket, private ACL, presigned GetObject URLs (TTL 3600s), no CDN at launch. Same-key overwrite strategy (users/{userId}/profile.{ext}) simplifies replace logic. Phase 5 unblocked.",
      "severity": "LOW",
      "state": "RESOLVED"
    },
    {
      "id": "OPEN-2-RESOLVED",
      "text": "OPEN-2 (image resizing): resolved to store originals (no server-side resize). Minimal-change default. ResizeService can be inserted in future without API changes.",
      "severity": "LOW",
      "state": "RESOLVED"
    },
    {
      "id": "OPEN-4-RESOLVED",
      "text": "OPEN-4 (soft vs permanent delete): resolved to permanent delete. DB column NULL + immediate S3 delete. If S3 fails, DB NULL is authoritative; orphan enqueued for async cleanup.",
      "severity": "LOW",
      "state": "RESOLVED"
    },
    {
      "id": "API-CONTRACT",
      "text": "API design: POST /users/{userId}/profile-image (multipart, 200 return {profile_image_url, profile_image_updated_at}), DELETE /users/{userId}/profile-image (204 idempotent), GET /users/{userId}/profile-image (200 or 404). Auth: Bearer JWT + X-CSRF-Token (web). Error codes: 400, 401, 403, 422 (4 validation variants), 502 (2 S3 variants).",
      "severity": "LOW",
      "state": "RESOLVED"
    },
    {
      "id": "DB-SCHEMA",
      "text": "Schema: add profile_image_url VARCHAR(2048) NULL and profile_image_updated_at TIMESTAMPTZ NULL to users table. No new indexes, no new tables. Migration additive-only (IF NOT EXISTS guard). Check constraint validates S3 URL pattern.",
      "severity": "LOW",
      "state": "RESOLVED"
    },
    {
      "id": "S3-STORAGE",
      "text": "S3 pattern: users/{userId}/profile.{ext} (private ACL, Block All Public Access enabled). Presigned GetObject URLs (3600s TTL, S3_URL_EXPIRY_SECONDS env var). Same-key overwrite on replace (no orphan for same-extension). Extension changes create orphan handled by OrphanCleanupShell.",
      "severity": "LOW",
      "state": "RESOLVED"
    },
    {
      "id": "BACKEND-COMPONENTS",
      "text": "New components: ProfileImageController, ProfileImageService, S3Adapter, MagicByteValidator, DimensionValidator, OrphanCleanupShell. Zero existing codegraph nodes affected (impact set empty). DB migration additive-only.",
      "severity": "LOW",
      "state": "RESOLVED"
    },
    {
      "id": "PLATFORM-FLOWS",
      "text": "iOS: UIImagePickerController → HEIC to JPEG encode (0.8 quality) → POST multipart. Android: ACTION_GET_CONTENT → Bitmap dimension check → POST multipart. Web: fetch API multipart, drag-drop file processing, progress events via UploadProgress.",
      "severity": "LOW",
      "state": "RESOLVED"
    },
    {
      "id": "SECURITY-AUTHORIZATION",
      "text": "Security: magic byte validation (not MIME type), X-CSRF-Token on web, authorization check (caller userId == path userId), private S3 ACL, no directory traversal (S3 key pattern fixed). CJIS scan: no payment/PII data involved; G-10 not triggered.",
      "severity": "LOW",
      "state": "RESOLVED"
    },
    {
      "id": "PERFORMANCE-RELIABILITY",
      "text": "Performance: 30s server timeout, 1 concurrent upload per user (SELECT FOR UPDATE row lock), 5 MB hard limit at validation. Error handling: validation (422), S3 errors (502), DB errors (500). Retry logic: client exponential backoff, server idempotent DELETE.",
      "severity": "LOW",
      "state": "RESOLVED"
    },
    {
      "id": "OPEN-5",
      "text": "NON-BLOCKING (small): OrphanCleanupShell must deploy in same release. If absent, orphaned objects accumulate (storage cost only). Owner: phase 5 software-engineer. Due: same sprint.",
      "severity": "LOW",
      "state": "OPEN"
    },
    {
      "id": "ADR-WRITTEN",
      "text": "ADR-005 (profile-upload-storage) written to .keel/memory/decisions/ADR-005-profile-upload-storage.md. Documents OPEN-2/3/4 resolutions, no contradictions with existing ADRs 1-4 (prior ADRs are CLI/dashboard; no overlap).",
      "severity": "LOW",
      "state": "RESOLVED"
    }
  ],
  "acceptance_criteria_ids": [
    "AC-1",
    "AC-2",
    "AC-3",
    "AC-4",
    "AC-5",
    "AC-6",
    "AC-7"
  ],
  "decisions": [
    "OPEN-3 resolved: S3 us-east-1, same-region, private ACL, presigned URLs (3600s TTL), no CDN at launch.",
    "OPEN-2 resolved: store originals; no server-side resize (minimal-change default, ResizeService insertable in future).",
    "OPEN-4 resolved: permanent delete; DB NULL authoritative; orphan cleanup async.",
    "API design: multipart POST (200 return), idempotent DELETE (204), GET (200/404). Auth: JWT + CSRF (web).",
    "Backend: ProfileImageController, Service, S3Adapter, validators, OrphanCleanupShell. Zero impact on existing codegraph.",
    "Mobile: iOS UIImagePickerController + HEIC→JPEG; Android ACTION_GET_CONTENT + bitmap check.",
    "Web: fetch multipart, drag-drop, progress events. Client-side retry with exponential backoff.",
    "DB: additive-only migration (2 nullable columns, IF NOT EXISTS guard)."
  ],
  "artifacts": [
    "docs/design/BASELINE-002-design.md",
    ".keel/memory/decisions/ADR-005-profile-upload-storage.md"
  ],
  "next_phase": 5,
  "blockers": [],
  "timestamp": "2026-07-31T00:00:00Z"
}
